Query Id,Query,Query Category,System_Output,Remarks
Q-001,Why did the customer Jerry Chavez escalate the call to a supervisor?,Causal Analysis (Escalation),"The customer escalated due to repeated service failures over a three-week period regarding mobile app login issues [cite: 7034-5430-2980-5483]. The specific trigger was the agent revealing that the ""system flagged your two-factor authentication"" a month ago, which the customer felt should have been communicated earlier [cite: 7034-5430-2980-5483].",Correctly identifies the lack of notification as the tipping point.
Q-002,"What evidence supports the ""Fraud Alert"" for customer Kyle Davis?",Evidence Retrieval,"The fraud alert is supported by two facts confirmed in the transcript: 1) A charge of $356.82 occurred at a restaurant in New York [cite: 1846-5500-2990-8975]. 2) The customer verified they have ""never been to New York"" and did not make the purchase [cite: 1846-5500-2990-8975].","Retrieves specific entities (Amount, Location) accurately."
Q-003,"What caused the ""System Conversion Failure"" event affecting Paul Lewis?",Root Cause Analysis,"The root cause was a failed overnight system upgrade. The agent states, ""The upgrade was scheduled during our maintenance window... The conversion didn't complete successfully"" [cite: 4741-5722-8435-4375]. This resulted in a nationwide outage affecting ATMs and online access.",Links technical failure to customer impact.
Q-004,Why is Amy Thomas threatening legal action?,Intent Classification,"The customer threatened legal action because this was the third consecutive time the company sent a broken device [cite: 3883-8555-9747-5746]. The causal factor is the repetitive failure of the fulfillment process, evidenced by the quote: ""My lawyer has advised me to document everything"" [cite: 3883-8555-9747-5746].","Identifies ""recurrence"" as the primary driver of legal threat."
Q-005,What workaround was offered to Anthony Patel for his internet outage?,Solution Extraction,"Due to a fiber line damage [cite: 1629-4503-4766-7087], the agent offered a temporary alternate connection method (likely a mobile hotspot or data credit) at no charge to resolve the immediate work-from-home urgency [cite: 1629-4503-4766-7087].",Extracts the mitigation strategy used by the agent.
